{
  "schema_version": 1,
  "provider_id": "objtoschematic",
  "display_name": "ObjToSchematic",
  "integration_policy": "EXTERNAL_PROVIDER",
  "proof_level": "EP1_HANDOFF_VERIFIED",
  "integration_mode": "MANUAL_FILE_HANDOFF",
  "capabilities": [
    "LITEMATIC_EXPORT",
    "MESH_TO_STRUCTURE",
    "SCHEMATIC_EXPORT"
  ],
  "audit": {
    "audited_at": "2026-09-12",
    "evidence": [
      {
        "kind": "OFFICIAL_SITE",
        "locator": "https://objtoschematic.com/",
        "observed_at": "2026-09-12",
        "supports": [
          "capability:MESH_TO_STRUCTURE",
          "handoff:MESH",
          "provider:objtoschematic"
        ],
        "sha256": null
      },
      {
        "kind": "OFFICIAL_DOCS",
        "locator": "https://objtoschematic.com/wiki",
        "observed_at": "2026-09-12",
        "supports": [
          "capability:LITEMATIC_EXPORT",
          "capability:MESH_TO_STRUCTURE",
          "capability:SCHEMATIC_EXPORT",
          "handoff:MESH",
          "handoff:SCHEMATIC_FILE",
          "proof:EP1_HANDOFF_VERIFIED"
        ],
        "sha256": null
      }
    ]
  },
  "api": {
    "state": "UNVERIFIED_API",
    "auth": "UNKNOWN",
    "official_contract": null
  },
  "handoff": {
    "accepted_input_kinds": [
      "MESH"
    ],
    "output_artifact_kinds": [
      "SCHEMATIC_FILE"
    ],
    "manual_action_required": true,
    "determinism": "UNKNOWN"
  },
  "limits": {
    "max_input_bytes": 16777216,
    "max_output_bytes": 67108864,
    "timeout_seconds": null
  },
  "profile_sha256": "78d1b12ff8c6ec4de8411e87dc447230256e6ad379ab7498267a3c1d09e2612f"
}
